{
  "fault_id": "01928f6e-aaaa-7aaa-8aaa-aaaaaaaaaaaa",
  "code": "ros.topic.stale",
  "source": {"robot": "tb4-sim", "node": "/jarvis/bridges/topic_watchdog", "component": "lidar"},
  "reporting_sources": ["/jarvis/bridges/topic_watchdog"],
  "state": "ACTIVE",
  "severity": "ERROR",
  "occurrences": 1,
  "first_seen": "2026-10-13T09:14:03.124000000Z",
  "last_seen": "2026-10-13T09:14:03.124000000Z",
  "confirmed_at": "2026-10-13T09:14:04.124000000Z",
  "cleared_at": "",
  "acknowledged": false,
  "acknowledged_by": "",
  "acknowledged_at": "",
  "latch": false,
  "cataloged": true,
  "muted_by": "",
  "incident_id": "01928f6e-9999-7999-8999-999999999999",
  "description": "A watched topic stopped publishing.",
  "message": "/scan silent for 1.6 s (expected 10 Hz)",
  "report_attrs": {"topic": "/scan", "node": "/demo/scan_relay"},
  "freeze_frame": {"topic": "/scan", "node": "/demo/scan_relay", "state.robot.mode": "AUTONOMOUS"}
}
